{
  "lumen_style_version": "1.0",
  "name": "lumen-dark",
  "tokens": {
    "color.primary": "#64d2ff",
    "color.secondary": "#30d158",
    "color.tertiary": "#ff6961",
    "color.background": "#1a1a1a",
    "color.surface": "#2c2c2e",
    "color.text.primary": "#f5f5f7",
    "color.text.secondary": "#98989d",
    "color.border": "#48484a",
    "font.family": "Inter",
    "font.size.default": 11,
    "line.width.default": 1.5,
    "marker.size.default": 5,
    "grid.color.major": "#333333",
    "grid.color.minor": "#2a2a2a"
  },
  "elements": {
    "axis.spine": { "stroke.color": "#48484a", "stroke.width": 0.8 },
    "axis.tick.label": { "font.size": 10, "color": "#98989d" },
    "axis.title": { "font.size": 12, "color": "#f5f5f7" },
    "grid.major": { "stroke.color": "#333333", "stroke.width": 0.5 },
    "legend.frame": { "stroke": null },
    "title": { "font.size": 17, "font.weight": "demibold" }
  }
}
