{
  "lumen_style_version": "1.0",
  "name": "print-bw",
  "tokens": {
    "color.primary": "#000000",
    "color.secondary": "#000000",
    "color.tertiary": "#000000",
    "color.background": "#ffffff",
    "color.text.primary": "#000000",
    "font.family": "Liberation Serif",
    "font.size.default": 10,
    "font.size.title": 14,
    "line.width.default": 1.0,
    "marker.size.default": 5,
    "grid.color.major": "#cccccc"
  },
  "elements": {
    "axis.spine": { "stroke.color": "#000000", "stroke.width": 0.5 },
    "axis.tick.label": { "font.size": 9, "color": "#000000" },
    "grid.major": { "stroke.color": "#cccccc", "stroke.width": 0.3 },
    "legend.frame": { "stroke.color": "#000000", "stroke.width": 0.3 },
    "title": { "font.size": 14, "font.weight": "bold" }
  }
}
