{
  "lumen_style_version": "1.0",
  "name": "lumen-light",
  "tokens": {
    "color.primary": "#0a84ff",
    "color.secondary": "#30d158",
    "color.tertiary": "#ff453a",
    "color.background": "#ffffff",
    "color.surface": "#f5f5f7",
    "color.text.primary": "#1d1d1f",
    "color.text.secondary": "#86868b",
    "color.border": "#d2d2d7",
    "font.family": "Inter",
    "font.size.default": 11,
    "font.size.title": 17,
    "font.size.label": 12,
    "font.size.tick": 10,
    "line.width.default": 1.5,
    "line.width.axis": 0.8,
    "line.width.grid": 0.5,
    "marker.size.default": 5,
    "grid.color.major": "#eeeeee",
    "grid.color.minor": "#f5f5f5"
  },
  "elements": {
    "axis.spine": { "stroke.color": "#d2d2d7", "stroke.width": 0.8 },
    "axis.tick.label": { "font.size": 10, "color": "#86868b" },
    "axis.title": { "font.size": 12, "color": "#1d1d1f" },
    "grid.major": { "stroke.color": "#eeeeee", "stroke.width": 0.5 },
    "grid.minor": { "stroke.color": "#f5f5f5", "stroke.width": 0.3 },
    "legend.frame": { "stroke": null },
    "legend.label": { "font.size": 10 },
    "title": { "font.size": 17, "font.weight": "demibold" }
  }
}
